Classification,Year,Period,Period Desc.,Aggregate Level,Is Leaf Code,Trade Flow Code,Trade Flow,Reporter Code,Reporter,Reporter ISO,Partner Code,Partner,Partner ISO,2nd Partner Code,2nd Partner,2nd Partner ISO,Customs Proc. Code,Customs,Mode of Transport Code,Mode of Transport,Commodity Code,Commodity,Qty Unit Code,Qty Unit,Qty,Alt Qty Unit Code,Alt Qty Unit,Alt Qty,Netweight (kg),Gross weight (kg),Trade Value (US$),CIF Trade Value (US$),FOB Trade Value (US$),Flag
S1,1967,1967,1967,3,0,1,Import,470,Malta,MLT,0,World,WLD,,,,,,,,673,"Iron and steel bars,rods,angles,shapes,sections",8,Weight in kilograms,,,7057585,,7057585,,749369,,,0
S1,1967,1967,1967,3,0,2,Export,470,Malta,MLT,0,World,WLD,,,,,,,,673,"Iron and steel bars,rods,angles,shapes,sections",1,No Quantity,,,0,,0,,106,,,0
S1,1967,1967,1967,3,0,1,Import,470,Malta,MLT,0,World,WLD,,,,,,,,674,"Universals,plates and sheets of iron or steel",1,No Quantity,,,0,,0,,385856,,,0
S1,1967,1967,1967,3,0,1,Import,470,Malta,MLT,0,World,WLD,,,,,,,,675,Hoop and strip of iron or steel,1,No Quantity,,,0,,0,,11288,,,0
S1,1967,1967,1967,3,0,1,Import,470,Malta,MLT,0,World,WLD,,,,,,,,677,"Iron and steel wire, excluding wire rod",1,No Quantity,,,0,,0,,111323,,,0
S1,1967,1967,1967,3,0,2,Export,470,Malta,MLT,0,World,WLD,,,,,,,,677,"Iron and steel wire, excluding wire rod",1,No Quantity,,,0,,0,,999,,,0
S1,1967,1967,1967,3,0,1,Import,470,Malta,MLT,0,World,WLD,,,,,,,,678,"Tubes,pipes and fittings of iron or steel",1,No Quantity,,,0,,0,,726512,,,0
S1,1967,1967,1967,3,0,2,Export,470,Malta,MLT,0,World,WLD,,,,,,,,678,"Tubes,pipes and fittings of iron or steel",1,No Quantity,,,0,,0,,2409,,,0
